[
  {"id":"e-search-scale","statement":"The source note reports 10,000 concurrent agents, 88 hours, 2.7 million messages, and approximately 130 billion output tokens.","provenance":"reported","source":"/Users/leoguinan/Downloads/NS Validation idea.md:157","status":"unverified","value":{"agents":10000,"hours":88,"messages":2700000,"output_tokens":130000000000},"unit":"mixed","notes":"Local note citation only; retrieve and independently check the underlying public source before treating this as externally verified."},
  {"id":"e-proof-length","statement":"The source note describes a 166-page construction.","provenance":"reported","source":"/Users/leoguinan/Downloads/NS Validation idea.md:3,157","status":"unverified","value":166,"unit":"pages","notes":"The note is not itself the proof artifact."},
  {"id":"e-formalization-time","statement":"The source note reports another 17 hours for formalization and verification.","provenance":"reported","source":"/Users/leoguinan/Downloads/NS Validation idea.md:157","status":"unverified","value":17,"unit":"hours","notes":"Do not compare directly with discovery wall-clock time until workloads and accounting boundaries are defined."},
  {"id":"e-compression-ratio","statement":"Verification compression is defined as construction cost divided by re-verification cost.","provenance":"modeled","source":"docs/terminology.md","status":"locally_checked","value":null,"unit":null,"notes":"No cost estimate is asserted by this definition."},
  {"id":"e-reuse-break-even","statement":"Reuse break-even is defined as new-verifier cost divided by old-check cost minus new-check cost.","provenance":"modeled","source":"docs/terminology.md","status":"locally_checked","value":null,"unit":null,"notes":"Undefined when the denominator is non-positive or units are incompatible."}
]
